{
  "route_id": "D",
  "core_idea": "受约束机器学习路线：Q1用交叉拟合的梯度提升模型探索非线性和交互；Q2/Q3用离散时间生存提升模型估计达标概率，并用浅层有序决策树或动态规划把个体最优时点压缩成BMI分组建议；Q4采用代价敏感的梯度提升分类并进行概率校准和解释。",
  "assumptions": [
    "附件样本量足以在严格按孕妇分组的验证下学习有限复杂度的非线性",
    "离散孕周网格能够充分表示4%达标过程",
    "单调约束可用于孕周对达标概率的影响，但不强迫原始Y浓度逐次单调",
    "最终BMI分组必须由低复杂度策略近似个体预测，不能直接输出黑箱建议",
    "训练时的质量变量在实际判定时均可获得"
  ],
  "key_equations": [
    "Ŷ_ij=f_GBM(week_ij,BMI_ij,x_i,q_ij)",
    "h_i(t)=P(T_i=t | T_i≥t,x_i)，F_i(t)=1-Π_{s≤t}[1-h_i(s)]",
    "t_i*=argmin_t {c_fail·[1-F_i(t)]+c_delay·D(t)}",
    "G*=argmin_{浅层BMI策略G} Σ_i L(t_{G(BMI_i)},t_i*)+λ·leaves(G)",
    "p_k(x)=Calibrate(GBM_k(x))，k∈{总体异常,13,18,21}"
  ],
  "required_data": [
    "清洗后的男胎纵向记录和离散孕周风险集",
    "孕妇级基础变量、检测时可得质量变量和明确缺失标记",
    "女胎总体及多标签异常目标",
    "嵌套分组交叉验证划分与预先限定的模型复杂度范围"
  ],
  "expected_strengths": [
    "能够发现线性、加性模型遗漏的非线性阈值和高阶交互",
    "可同时估计个体达标曲线并压缩为可执行BMI分组",
    "对Q4的复杂质量效应和变量交互具有较强预测能力",
    "可用置换重要性和局部解释识别模型依赖因素"
  ],
  "main_risks": [
    "267名男胎和147名女胎的独立孕妇数量有限，黑箱模型容易过拟合",
    "逐行随机切分会产生严重泄漏，必须严格按孕妇代码分组",
    "特征重要性不代表因果关系，解释容易过度",
    "把个体策略压缩为BMI分组可能损失预测优势",
    "异常类别稀少可能导致表面准确率高但灵敏度低"
  ],
  "validation_plan": [
    "使用嵌套GroupKFold或留组验证，比较朴素、路线A和路线B基线",
    "限制树深、叶节点和特征数量，并报告训练验证差距",
    "检查达标概率单调性、概率校准、Brier分数和时间相关性能",
    "对孕妇、特征和测量误差进行Bootstrap稳定性分析",
    "比较压缩BMI策略与个体策略的风险损失和解释性代价",
    "Q4重点报告PR-AUC、灵敏度、特异度、校准和按孕妇分组的混淆矩阵"
  ],
  "implementation_cost": "high",
  "interpretability": "low",
  "innovation_potential": "high"
}
