{
  "route_id": "A",
  "core_idea": "经典可解释基线：Q1用带孕妇随机截距的线性混合模型描述Y浓度；Q2采用临床BMI分段与组内达标概率；Q3用广义线性混合模型扩展多因素；Q4以|Z|阈值和质量过滤为基线，并用低维Logistic回归校准。",
  "assumptions": [
    "在适当变换后，Y浓度与孕周、BMI及少量交互项的关系可由低阶线性结构近似",
    "孕妇随机截距足以吸收主要个体内相关性",
    "预先给定的临床BMI区间具有足够样本量并可解释",
    "女胎异常可由Z值和测序质量变量的低维可加关系判别"
  ],
  "key_equations": [
    "g(Y_ij)=β0+β1·week_ij+β2·BMI_ij+β3·week_ij·BMI_ij+b_i+ε_ij",
    "p_g(t)=P(Y≥0.04 | BMI组g, week=t)",
    "t_g*=argmin_t {c_fail·[1-p_g(t)]+c_delay·D(t)}，10≤t≤25",
    "logit P(AB≠空)=α0+Σ_k α_k x_k"
  ],
  "required_data": [
    "男胎孕妇代码、检测孕周、BMI、Y染色体浓度及基础协变量",
    "女胎AB标签、13/18/21/X染色体Z值、GC和读段质量变量",
    "按孕妇代码定义的训练验证分组"
  ],
  "expected_strengths": [
    "参数含义直观，适合作为所有复杂路线的统一基线",
    "实现成本较低，容易检查单位、残差和组内相关性",
    "BMI分组与检测时点便于形成临床可读建议",
    "Q4规则与Logistic模型便于解释误判原因"
  ],
  "main_risks": [
    "线性与可加假设可能遗漏孕周增长曲线和阈值附近的非线性",
    "固定BMI分组可能不是风险最优分区",
    "随机截距可能不足以描述不同孕妇的增长斜率",
    "异常样本较少时Logistic估计不稳定"
  ],
  "validation_plan": [
    "按孕妇代码分组交叉验证，禁止同一孕妇跨训练集和验证集",
    "检查混合模型残差、随机效应、交互项显著性和非线性迹象",
    "与统一12周检测和题目示例BMI分组比较风险",
    "对4%阈值、风险权重、检测误差和BMI边界进行敏感性分析",
    "Q4报告灵敏度、特异度、PR-AUC、校准与按异常类型的混淆情况"
  ],
  "implementation_cost": "low",
  "interpretability": "high",
  "innovation_potential": "low"
}
