{
  "route_id": "B",
  "core_idea": "半参数删失时间路线：Q1用广义加性混合模型刻画孕周和BMI的非线性；Q2/Q3把首次达到4%视为区间删失事件，估计条件达标概率，再以带最小组样本约束的有序最优分箱选择BMI边界和时点；Q4采用带正则化和校准的Logistic多标签模型。",
  "assumptions": [
    "Y浓度的总体趋势平滑，但允许不同孕妇存在相关重复观测",
    "相邻两次检测之间的首次达标时间可作为区间删失数据处理",
    "给定协变量后，删失机制近似非信息性",
    "BMI分组应保持区间有序，并满足预先声明的最小孕妇数",
    "女胎多标签异常可由稀疏或正则化的可加预测结构近似"
  ],
  "key_equations": [
    "g(Y_ij)=β0+s1(week_ij)+s2(BMI_ij)+s3(week_ij,BMI_ij)+b_i+ε_ij",
    "T_i=inf{t:Y_i(t)≥0.04}，由(L_i,R_i]区间或右删失观测",
    "p_i(t)=P(T_i≤t | BMI_i, age_i, height_i, weight_i, IVF_i, quality_i)",
    "(G*,t*)=argmin_{有序分区G,各组时点t_g} Σ_i[c_fail·(1-p_i(t_g))+c_delay·D(t_g)]+λ·复杂度(G)",
    "logit P(T_k=1)=α_k0+x'α_k，k∈{13,18,21}"
  ],
  "required_data": [
    "男胎全部纵向Y浓度、检测孕周、孕妇代码及多因素协变量",
    "能区分多次抽血与同次抽血重复检测的日期和抽血次数",
    "女胎AB多标签、Z值、GC、读段数及质量比例",
    "人工确认的风险权重、概率门槛和最小组样本约束"
  ],
  "expected_strengths": [
    "直接处理首次达标的区间观测和未达标右删失，避免删除困难样本",
    "允许孕周、BMI和交互效应非线性，同时保留较强解释性",
    "分组边界与推荐时点共同优化且可施加稳定性约束",
    "能够自然输出各组达标概率和置信区间",
    "Q1至Q3共享一致的概率对象，论文逻辑连贯"
  ],
  "main_risks": [
    "区间删失模型和最优分箱实现复杂度高于经典基线",
    "达标后浓度若明显回落，单一首次事件表述可能丢失信息",
    "平滑自由度与分组惩罚若调节不当会过拟合",
    "多标签异常样本量可能不足以稳定估计所有染色体模型"
  ],
  "validation_plan": [
    "按孕妇分组进行嵌套交叉验证，所有平滑度和正则参数只在训练折选择",
    "检查删失比例、达标后回落、比例风险或所选时间模型假设",
    "与路线A、统一检测时点和题目示例BMI边界比较样本外风险",
    "使用Bootstrap孕妇重采样评估BMI切点和推荐时点稳定性",
    "对Y浓度和孕周加入测量误差情景，报告建议改变范围",
    "Q4使用分组验证、类别权重、概率校准及每个染色体的灵敏度和PR-AUC"
  ],
  "implementation_cost": "medium",
  "interpretability": "high",
  "innovation_potential": "medium"
}
