{
  "route_id": "C",
  "core_idea": "贝叶斯层级机制路线：为每名男胎孕妇建立带个体随机参数的饱和增长曲线和显式测量误差，推导首次达到4%的后验分布，以后验期望风险联合优化BMI分组与检测时点；Q4采用质量感知的贝叶斯多标签Logistic模型。",
  "assumptions": [
    "Y浓度随孕周总体呈单调或近似单调的饱和增长，可由层级非线性曲线描述",
    "个体增长参数来自由BMI、年龄、身高、体重和妊娠方式解释的总体分布",
    "测量误差分布可由重复检测估计，且同次抽血与不同抽血可使用不同方差",
    "先验信息只提供正则化，不替代附件数据证据",
    "女胎各染色体异常允许共享层级信息但保持各标签的独立判定输出"
  ],
  "key_equations": [
    "Y_ij=A_i/[1+exp{-k_i(t_ij-τ_i)}]+ε_ij",
    "(log A_i,log k_i,τ_i)=B·x_i+u_i",
    "T_i=inf{t:Y_i(t)≥0.04}，由后验抽样得到P(T_i≤t | data)",
    "(G*,t*)=argmin E_posterior[Σ_i L(t_{g(i)},T_i)+λK]",
    "logit P(T_ik=1)=α_k0+x_i'α_k+q_i'γ，k∈{13,18,21}"
  ],
  "required_data": [
    "男胎纵向Y浓度、孕周、BMI和孕妇协变量",
    "用于区分误差来源的抽血次数、检测日期和测序质量指标",
    "女胎AB多标签和全部检测时可获得的染色体与质量特征",
    "风险函数、先验尺度和收敛判据的预先声明"
  ],
  "expected_strengths": [
    "统一表达个体差异、测量误差、删失和推荐时点不确定性",
    "可以直接给出达标时间、分组边界和风险的后验区间",
    "重复测量信息利用充分，适合解释同一孕妇的动态轨迹",
    "机制曲线与决策损失结合具有较高创新潜力"
  ],
  "main_risks": [
    "部分孕妇观测点少，非线性个体参数可能弱可识别",
    "Y浓度存在非单调波动时，饱和增长假设可能失真",
    "计算和收敛诊断成本高，竞赛时间内实现风险较大",
    "先验选择可能显著影响稀疏BMI区间和异常类别结论"
  ],
  "validation_plan": [
    "实施后验预测检查，比较Y浓度分布、个体轨迹和阈值穿越时间",
    "报告多链收敛、有效样本量、参数相关性和可识别性诊断",
    "与线性混合模型、半参数路线和统一时点基线比较样本外预测与风险",
    "对增长曲线形式、误差分布、先验尺度和风险权重进行敏感性分析",
    "按孕妇留组验证后验区间覆盖和概率校准",
    "Q4报告后验概率校准、类别不平衡性能和标签间共享假设的敏感性"
  ],
  "implementation_cost": "high",
  "interpretability": "medium",
  "innovation_potential": "high"
}
